vehicleType,benefit,checked,valuation,make,supplier,mileage,supplierPrice,year,comment,url
Truck,-3.0,True,3939131.0,SCANIA,M7 TRUCK Уфа,742318.0,4095000.0,2015.0,M7truck   это седельные тягачи  спецтехника и прицепная техника с пробегом  которым Вы можете доверять  Любая форма оплаты  нал безнал   Возможна продажа в кредит  лизинг  Более 25 партнеров  Сбербанк  ВТБ  Европлан  Сбербанк Лизинг  ВЭБ лизинг  Элемент лизинг и др   В наличии более 200 единиц седельных тягачей  грузовиков  самосвалов  спецтехники Scania  Volvo  DAF  Mercedes  MAN  MAZ  KAMAZ и прицепной техники  изотермы  рефрижераторы  тентованные  контейнеровозы Krone  Schmitz  Kogel и др  с минимальными пробегами после ТО  готовых к дальнейшей работе  Место осмотра  г  Уфа,https://auto.ru/artic/used/sale/scania/r_1/16283660-78dc8e14/
Truck,-1.0,True,4016552.0,SCANIA,M7 TRUCK Уфа,674000.0,4095000.0,2015.0,M7truck   это седельные тягачи  спецтехника и прицепная техника с пробегом  которым Вы можете доверять  Любая форма оплаты  нал безнал   Возможна продажа в кредит  лизинг  Более 25 партнеров  Сбербанк  ВТБ  Европлан  Сбербанк Лизинг  ВЭБ лизинг  Элемент лизинг и др   В наличии более 200 единиц седельных тягачей  грузовиков  самосвалов  спецтехники Scania  Volvo  DAF  Mercedes  MAN  MAZ  KAMAZ и прицепной техники  изотермы  рефрижераторы  тентованные  контейнеровозы Krone  Schmitz  Kogel и др  с минимальными пробегами после ТО  готовых к дальнейшей работе  Место осмотра  г  Уфа,https://auto.ru/artic/used/sale/scania/r_1/16283804-1efe32ec/
Truck,2.0,True,4191971.0,SCANIA,ТТ777,531000.0,4099777.0,2015.0,Седельный тягач Scania R440 StreamLine 2015г Стоимость с НДС  можно приобрести в ЛИЗИНГ или КРЕДИТ  Работал по Европе с рефрижератором  без перегрузов  Полностью обслужен  есть история  все своевременно  ДВС DC13 440л с   РКПП Scania GRS OptiCruise 12g Комплектация  2 спальных места  полный электропакет  бортовой компьютер  климат контроль  автономка WEBASTO  холодильник  круиз контроль  пневмокресла ComfortAir  Остаток резины 60   европейка  Вложений не требует  готов сразу отправиться в рейс ,https://auto.ru/artic/used/sale/scania/r_1/16305090-95ed52fe/
Truck,0.0,True,5140394.0,SCANIA,M7 TRUCK Набережные Челны,365237.0,5145000.0,2017.0,В продаже седельный тягач Scania R400  Скания  2017 г в   Своевременное техническое обслуживание   Цена указана с НДС   Место осмотра  г  Набережные Челны  Код  3907839  Характеристики       Пробег  тыс км   365 237     Год выпуска  2017     Марка  Scania     Тормозная система  диск тормоза     Страна сборки  Бразилия     Полная масса  кг   19 000     Грузоподъемность  кг   10 915     Тип подвески  Пневмо ресс подвеска     Колесная формула  4х2     Мощность двигателя  л с   400     КПП тип  Автомат  Дополнительно  высокая кабина  магнитола  кондиционер  холодильник  электропривод и подогрев зеркал  тахограф  круиз контроль  автономный отопитель  противотуманные фары  ABS  Готов к эксплуатации   Торг возможен при осмотре   M7truck   это сертифицированные грузовики  седельные тягачи  спецтехника и прицепная техника с пробегом  которым Вы можете доверять   Любая форма оплаты  нал безнал   Возможна продажа в кредит  лизинг   Более 25 партнеров  Сбербанк  ВТБ  Европлан  Восток Лизинг  Сбербанк Лизинг  ВЭБ лизинг  Элемент лизинг и др ,https://auto.ru/artic/used/sale/scania/r_1/16305210-3edfc95e/
Truck,0.0,True,4089912.0,SCANIA,M7 TRUCK Уфа,634512.0,4095000.0,2015.0,M7truck   это седельные тягачи  спецтехника и прицепная техника с пробегом  которым Вы можете доверять  Любая форма оплаты  нал безнал   Возможна продажа в кредит  лизинг  Более 25 партнеров  Сбербанк  ВТБ  Европлан  Сбербанк Лизинг  ВЭБ лизинг  Элемент лизинг и др   В наличии более 200 единиц седельных тягачей  грузовиков  самосвалов  спецтехники Scania  Volvo  DAF  Mercedes  MAN  MAZ  KAMAZ и прицепной техники  изотермы  рефрижераторы  тентованные  контейнеровозы Krone  Schmitz  Kogel и др  с минимальными пробегами после ТО  готовых к дальнейшей работе  Место осмотра  г  Уфа,https://auto.ru/artic/used/sale/scania/r_1/16306560-6c570207/
Truck,19.0,True,4051607.0,SCANIA,ТК Автокомбинат,580000.0,3400000.0,2015.0,Седельный тягач Scania сборка Швеция Куплен в 2016 году  год выпуска по ПТС 2015 400 л с  самая надежная топливная система PDE Кабина   2 спальных места  люк Пробег   580 000 км Коробка  оптикруз Мультируль Два Бака Резина   80  остаток  Тахограф  Автономный отопитель  блокировка  Тягач работал на Европейских перевозках  в отличном состоянии  ухожен  проходил обслуживание ТОЛЬКО в дилерском сервисе  Готов к эксплуатации  Торг возможен при осмотре  Цена указана с НДС  Возможна продажа в кредит,https://auto.ru/artic/used/sale/scania/r_1/16308638-5cb39a08/
Truck,11.0,True,5496666.0,SCANIA,,450000.0,4950000.0,2017.0,Только бережная эксплуатация и строгое  своевременное обслуживание у официального дилера  Дополнительная информация по телефону  Топливная система PDE  Топливные баки 500 и 600л  Оптика ксенон  Дисковые тормоза  ABS EBS  система удержания на склоне  Горный тормоз  Подвеска   передняя рессорная  задняя пневматическая  Шины   рулевая ось MICHELIN  ведущая ось CONTINENTAL 315 70 R22 5 2 спальных места  ширина нижнего места 800 мм  верхнего 700 мм  Автономный отопитель EBERSPAСHER  Климат контроль  Холодильник с морозильным отделением  Категория сиденья водителя   Премиум  материал обивки   велюр  Рулевое колесо   стандартное  Ветровое стекло тонированное  Люк с электроприводом  Комбинация приборов Colour plus  Автомагнитола Премиум  с Bluetooth  Тахограф   ШТРИХ  Идентификация водителя  Противотуманные фары   Цена указана с НДС  Возможна продажа через дилера SCANIA  Возможно продажа с полуприцепом  рефрижератор KRONE 2017г   Возможен лизинг  кредит,https://auto.ru/artic/used/sale/scania/r_1/16317268-66233a94/
Truck,-5.0,True,4358857.0,SCANIA,M7 TRUCK Москва,689374.0,4635000.0,2016.0,M7truck   это седельные тягачи  спецтехника и прицепная техника с пробегом  которым Вы можете доверять  Любая форма оплаты  нал безнал   Возможна продажа в кредит  лизинг  Более 25 партнеров  Сбербанк  ВТБ  Европлан  Сбербанк Лизинг  ВЭБ лизинг  Элемент лизинг и др   В наличии более 200 единиц седельных тягачей  грузовиков  самосвалов  спецтехники Scania  Volvo  DAF  Mercedes  MAN  MAZ  KAMAZ и прицепной техники  изотермы  рефрижераторы  тентованные  контейнеровозы Krone  Schmitz  Kogel и др  с минимальными пробегами после ТО  готовых к дальнейшей работе  Место осмотра  г  Москва,https://auto.ru/artic/used/sale/scania/r_1/16321782-2f0c96d7/
Truck,1.0,True,3907141.0,SCANIA,АТРАКС,780274.0,3850000.0,2015.0,СКАНИЯ R440   ГРУЗОВОЙ ТЯГАЧ СЕДЕЛЬНЫЙ   2015 год   ПРОБЕГ 780 274 КМ   ДВИГАТЕЛЬ DC13 104 L01  ДИЗЕЛЬНЫЙ  13 Л   440 Л С    ЭКОЛОГИЧЕСКИЙ КЛАСС ЕВРО  4   ТОПЛИВНАЯ СИСТЕМА PDE   КПП МЕХАНИЧЕСКАЯ   КОЛЕСНАЯ ФОРМУЛА 4Х2   ДВУХМЕСТНАЯ  ОДНОСПАЛЬНАЯ КАБИНА С ЛЮКОМ   ТОРМОЗА ДИСКОВЫЕ   ABS  EBS  МКБ   ПОДВЕСКА ПНЕВМО  РЕССОРНАЯ   СБОРКА ШВЕЦИЯ   АВТОНОМНЫЙ ОТОПИТЕЛЬ   ТАХОГРАФ   КОНДИЦИОНЕР   ХОЛОДИЛЬНИК   КРУИЗ  КОНТРОЛЬ   МАГНИТОЛА   ПОДОГРЕВ ТОПЛИВА   ЭЛЕКТРОПРИВОД ЗЕРКАЛ И СТЕКОЛ   МАССА БЕЗ НАГРУЗКИ 7496 КГ   РАЗРЕШЕННАЯ MAX МАССА 19 000 КГ   НАЛИЧНЫЙ  БЕЗНАЛИЧНЫЙ РАСЧЕТ  С НДС   ЛИЗИНГ  КРЕДИТ ЗВОНОК БЕСПЛАТНЫЙ,https://auto.ru/artic/used/sale/scania/r_1/16341448-498be4e4/
Truck,-3.0,True,4971934.0,SCANIA,M7 TRUCK Казань,598000.0,5135000.0,2017.0,В наличии седельные Тягачи Scania R440  Скания  2017 г в   Scania R440  2016г  114 шт  в наличии   Scania R440   2017г  79 шт  в наличии   Отличное внешнее и внутреннее состояние  по технике без замечаний  Один собственник  Все ТО по регламенту и только у Официального дилера Скания    Имеется вся документация по каждому заезду Тягача на станцию   Продажа с НДС   Место осмотра   г  Санкт Петербург   г  Москва   г  Н  Новгород   г  Казань   г  Наб  Челны   г  Уфа   Характеристики     Пробег  тыс км  598 000 км   Год выпуска  2017   Марка  SCANIA R440   Тормозная система  дисковые   Страна сборки  НИДЕРЛАНДЫ   Количество спальных мест  2   Количество осей  2   Полная масса  кг   19000   Грузоподъемность  кг   10800   Высота седла  мм  1150   Тип подвески  Пневмо рессорная   Мощность двигателя  л с   440   КПП тип  Автомат   Дополнительно   высокая кабина  магнитола  кондиционер  холодильник  электропривод и подогрев зеркал  тахограф  круиз контроль  автономный отопитель  ТО только у оф дилера Scania  имеется диагностический лист  противотуманные фары  ABS   Готов к эксплуатации    Торг возможен при осмотре   M7truck   это сертифицированные грузовики  седельные тягачи  спецтехника и прицепная техника с пробегом  которым Вы можете доверять  Любая форма оплаты  нал безнал     Возможна продажа в кредит  лизинг  Более 25 партнеров  Сбербанк  ВТБ  Европлан  Сбербанк Лизинг  ВЭБ лизинг  Элемент лизинг и др    В наличии более 200 единиц седельных тягачей  грузовиков  самосвалов  спецтехники Scania  Volvo  DAF  Mercedes  MAN  MAZ  KAMAZ и прицепной техники  изотермы  рефрижераторы  тентованные  контейнеровозы Krone  Schmitz  Kogel и др  с минимальными пробегами после ТО  готовых к дальнейшей работе ,https://auto.ru/artic/used/sale/scania/r_1/16355820-06288e7e/
Truck,-5.0,True,3902549.0,SCANIA,Скан-Юго-Восток,699304.0,4150000.0,2015.0,Готов к эксплуатации  Своевременное техническое обслуживание у официального дилера  был заключен сервисный контракт  Возможна продажа в лизинг  Цена указана с НДС  Торг возможен при осмотре ,https://auto.ru/artic/used/sale/scania/r_1/16359074-df5cc463/
Truck,19.0,True,4051607.0,SCANIA,ТК Автокомбинат,602000.0,3390000.0,2015.0,Седельный тягач Scania сборка Швеция Куплен в 2016 году  год выпуска по ПТС 2015 400 л с  самая надежная топливная система PDE Кабина   2 спальных места  люк Пробег   590 000 км Коробка  оптикруз Мультируль Два Бака Резина   80  остаток  Тахограф  Автономный отопитель  блокировка  Тягач работал на Европейских перевозках  в отличном состоянии  ухожен  проходил обслуживание ТОЛЬКО в дилерском сервисе  Готов к эксплуатации  Торг возможен при осмотре  Цена указана с НДС  Возможна продажа в кредит,https://auto.ru/artic/used/sale/scania/r_1/16359254-4330c8c6/
Truck,-3.0,True,4974172.0,SCANIA,M7 TRUCK Казань,596000.0,5135000.0,2017.0,В наличии седельные Тягачи Scania R440  Скания  2017 г в   Scania R440  2016г  114 шт в наличии   Scania R440   2017г  79 шт в наличии   Отличное внешнее и внутреннее состояние  по технике без замечаний  Один собственник  Все ТО по регламенту и только у Официального дилера Скания    Имеется вся документация по каждому заезду Тягача на станцию   Продажа с НДС   Место осмотра   г  Санкт Петербург   г  Москва   г  Н  Новгород   г  Казань   г  Наб  Челны   г  Уфа   Характеристики     Пробег  тыс км   500 000   700 000 км   Год выпуска  2017   Марка  SCANIA R440   Тормозная система  дисковые   Страна сборки  НИДЕРЛАНДЫ   Количество спальных мест  2   Количество осей  2   Полная масса  кг   19000   Грузоподъемность  кг   10800   Высота седла  мм  1150   Тип подвески  Пневмо рессорная   Мощность двигателя  л с   440   КПП тип  Автомат    Дополнительно    высокая кабина  магнитола  кондиционер  холодильник  электропривод и подогрев зеркал  тахограф  круиз контроль  автономный отопитель  ТО только у оф дилера Scania  имеется диагностический лист  противотуманные фары  ABS   Готов к эксплуатации    Торг возможен при осмотре   M7truck   это сертифицированные грузовики  седельные тягачи  спецтехника и прицепная техника с пробегом  которым Вы можете доверять  Любая форма оплаты  нал безнал     Возможна продажа в кредит  лизинг  Более 25 партнеров  Сбербанк  ВТБ  Европлан  Сбербанк Лизинг  ВЭБ лизинг  Элемент лизинг и др ,https://auto.ru/artic/used/sale/scania/r_1/16359786-83e3c17f/
Truck,-3.0,True,4939032.0,SCANIA,M7 TRUCK Казань,627000.0,5135000.0,2017.0,В наличии седельные Тягачи Scania R440  Скания  2017 г в   Scania R440  2016г  114 шт в наличии   Scania R440   2017г  79 шт в наличии   Отличное внешнее и внутреннее состояние  по технике без замечаний  Один собственник  Все ТО по регламенту и только у Официального дилера Скания    Имеется вся документация по каждому заезду Тягача на станцию   Продажа с НДС   Место осмотра   г  Санкт Петербург   г  Москва   г  Н  Новгород   г  Казань   г  Наб  Челны   г  Уфа   Характеристики     Пробег  тыс км   500 000   700 000 км   Год выпуска  2017   Марка  SCANIA R440   Тормозная система  дисковые   Страна сборки  НИДЕРЛАНДЫ   Количество спальных мест  2   Количество осей  2   Полная масса  кг   19000   Грузоподъемность  кг   10800   Высота седла  мм  1150   Тип подвески  Пневмо рессорная   Мощность двигателя  л с   440   КПП тип  Автомат    Дополнительно    высокая кабина  магнитола  кондиционер  холодильник  электропривод и подогрев зеркал  тахограф  круиз контроль  автономный отопитель  ТО только у оф дилера Scania  имеется диагностический лист  противотуманные фары  ABS   Готов к эксплуатации    Торг возможен при осмотре   M7truck   это сертифицированные грузовики  седельные тягачи  спецтехника и прицепная техника с пробегом  которым Вы можете доверять  Любая форма оплаты  нал безнал     Возможна продажа в кредит  лизинг  Более 25 партнеров  Сбербанк  ВТБ  Европлан  Сбербанк Лизинг  ВЭБ лизинг  Элемент лизинг и др ,https://auto.ru/artic/used/sale/scania/r_1/16359800-2413957c/
Truck,26.0,True,6791444.0,SCANIA,СибТракСкан,730000.0,5350000.0,2016.0,Продается седельный тягач Scania R440 6X2 2016 г в Очень хорошее внешнее и техническое состояние АКПП Пробег 730000 Работал под перевозкой опасных грузов Авто оформлен на физ  лицо ЦЕНА БЕЗ НДС ПОМОЩЬ В ПОЛУЧЕНИИ КРЕДИТА  СибТракСкан    официальный дилер шведского автомобильного концерна  Scania  в г  Новосибирске с гордостью представляет SCANIA   надежную европейскую технику С ЭКОНОМИЧНЫМ РАСХОДОМ ТОПЛИВА  которая позволит зарабатывать Вам больше  У нас СОБСТВЕННОЕ ЛИЗИНГОВОЕ ПОДРАЗДЕЛЕНИЕ  техника предоставляется в лизинг сроком до пяти лет с первоначальным взносом от 15  до 49   Минимальное удорожание  Трейд ин  Рассмотрим варианты обмена на грузовую технику  Адрес  г  Новосибирск  ул  Толмачевская 33 3 Своевременное техническое обслуживание  Возможна продажа в кредит  Готов к эксплуатации,https://auto.ru/artic/used/sale/scania/r_1/16360480-b55ca6d7/
Truck,12.0,True,4259361.0,SCANIA,Globaltruck,450000.0,3800000.0,2015.0,Крупная Логистическая компания  в состав которой входят ГлобалТрак Лоджистик  Лонгран Лоджистик  Лорри  Магна  Проводим Плановое Обновление собственного автопарка Тягачей  В связи с чем предлагаем Вам  Седельный тягач Scania R 400 Год выпуска  2015 Пробег  450 000 Двигатель  мощность 400 л с  КПП  автомат Топливная система  PDE 2 топливных бака  холодильник  люк  Своевременное обслуживание  проведена предпродажная диагностика  Кредит Лизинг  Цена указана с НДС   Мы успешно сотрудничаем с более чем 15 лизинговыми компаниями по всей России   Мы первые и единственные собственники   Не перекупщики   ПТС оригинал   Приехав к нам на площадку  Вы 100  подберете себе Автомобиль по своему запросу и требованию   Техника Обслуживалась в Официальном сервисном центре   Сервисные книжки с Отметками о прохождения ТО  и всей историей авто  предоставляем клиентам   Оригинальный Пробег автомобиля Подтверждается также Отметками в Сервисной книге   100  Юридическая чистота техники подтверждается полным пакетом док ов на каждую единицу,https://auto.ru/artic/used/sale/scania/r_1/16361376-d35587bb/
Truck,10.0,True,4082538.0,SCANIA,,645000.0,3680000.0,2015.0,В связи с обновлением парка  продается Scania R440  Низкорамник  2015 г в  двигатель 12 7  440л с   евро 5  топливная PDE  сборка Нидерланды  КПП  Opticruise   2 бака 500 700л   кабина высокая  2 спальных места  автономный отопитель  холодильник  люк  климат контроль  цифровой тахограф  Состояние отличное  Возможна продажа сцепкой с полуприцепам Schmitz SCS 24  Mega  2015 г в  двухуровневая погрузка  полная штора  сзади ворота 105куб   высота внутри 3м  колеса 19 5  Один собственник  работали на Европу  Посредникам и прочим помощникам не беспокоить,https://auto.ru/artic/used/sale/scania/r_1/16363370-b41a1721/
