vehicleType,benefit,checked,valuation,make,supplier,mileage,supplierPrice,year,comment,url
Refrigerator,-1.0,True,4450520.0,KRONE,Европлан Санкт-Петербург,20000.0,4500000.0,2019.0,Код предложения  2178363 ФЛ СПБ 19  Покупая автомобиль в Европлан   100  гарантию законности сделки  профессиональный и индивидуальный подход  быстрое заключение договора  различные варианты оформления  Автомобиль приобретался у официального дилера и принадлежит компании Европлан  то есть не находится в кредите  залоге или розыске   в наличии 3 полуприцепа   Год выпуска  2019 Страна  ГЕРМАНИЯ   ПТС  737965 Серия ПТС  78 УХ ПТС дата выдачи  14 11 2019 Кем выдан ПТС  Центральная акцизная таможня Номер двигателя  ОТСУТСТВУЕТ Модель двигателя  ОТСУТСТВУЕТ Номер кузова  ОТСУТСТВУЕТ Номер шасси  WKESD000000836658 Цвет  БЕЛЫЙ Тип двигателя  НЕ УСТАНОВЛЕНО    Производитель ТС FAHRZEUGWERK BERNARD KRONE GMBH amp CO KG  ГЕРМАНИЯ    Кол во мест 0 ХОУ Термо Кинг SLX200 Руслан от минус 20 до плюс 12 FRC полуприцеп рефрижератор KRONE Cool Liner  модель SDR 27 eL4 S Технические характеристики для допуска к эксплуатации на территории Российской Федерации  нагрузка на седельно сцепное устройство           12 000 кг   осевая нагрузка    24 000 кг  допустимая общая масса 36 000 кг     технически возможная осевая нагрузка   27 000 кг технически возможная общая масса для тягача соответствующего ISO 1726     39 000 кг  высота седла тягача в незагруженном состоянии 1 150 мм   Шасси Две Т образные продольные балки и поперечины  задняя траверса с диагональным подкосом  Высота рамы в передней части 10 мм  8 мм скользящая плита    2  двухдюймовый шкворень  радиус переднего свеса 1 595 мм   Заднее противоподкатное защитное устройство в соответствии с Директивой ЕС   Боковое противоподкатное защитное устройство  Выдвижная лестница сзади  Опорные стойки 2 домкрата с механическим приводом  допусти мая нагрузка 2 х 12 т  полукруглой формы с опорной пластиной  изготовитель по выбору завода KRONE  Управление домкратами с одной стороны  правой    Оси мост 3 оси с допустимой нагрузкой 9 000 кг на каждую  межосевое расстояние 1 310 мм   1 310 мм   оси SAF с пневмоподвеской и дисковыми тормозами 430 мм   усиленное исполнение   x27 Off Road  x27  Расстояние осевого агрегата 7 460 мм   Пневмоподвеска с устройством подъема и опускания  1 клапан  Центрирование обода по ступице колеса  Шины  колесные диски  6 штук  385 65 R 22 5  11 75 х 22 5   изготовитель по нашему выбору  Запасное колесо Центрирование обода по ступице колеса   Держатель запасного колеса Корзиночного типа за осевым агрегатом  2 единицы  Крылья Пластмассовые  полукруглой формы   Тормозная система Тормозная система соответствует требованиям ЕС 71 320  EWG ff и ECE R13  включает внешний разъем для  подключения диагностического оборудования  Стояночный тормоз с пружинным приводом  Разъемы для  подключения тормозной системы на передней стенке на высоте прибл  350 мм от края платформы  2 противооткатных башмака  Система ЕВS  2S 2M  2 датчика на одной оси  система ЕВS марки Wabco  Модулятор EBS с электронной системой стабилизации транспортного средства  RSS   Внимание  Полуприцеп разрешается использовать только с тягачом  оборудованным ABS   Фонари  Освещение и устройства подачи светового сигнала соответствуют требованиям ЕС 76 756 EWG ff  2 фонаря подсветки номерного знака 2 габаритных фонаря с резиновыми ручками габаритные боковые светодиодные фонари электроразъемы на передней стенке на высоте прибл  300 мм от края платформы 24 В  7 контактный разъем в соответствии со стандартом ISO 1185 7 контактный разъем в соответствии со стандартом ISO 3731 для дополнительных функций дополнительный 15 контактный разъем в соответствии со стандартом ISO 12098 задние многофункциональные фонари включают  1 противотуманную фару и 1 фонарь заднего хода  Аксессуары  пластмассовый топливный бак емкостью 240 л  заправочное отверстие с двух сторон 2 красно желтых отражателя  565х200мм  устанавливаются на задней стенке 2 складные таблички TIR  4 резиновые бампера сзади  резиновый бампер из дельта профиля сзади поперек задней рамы  Днище  Тип днища  ВО 13360  Шумопоглощающий алюминиевый поддон  Допустимая нагрузка на пол проверена в соответствии с CSC EN 238  Дополнительное усиление в задней части  Надстройка  Тип надстройки  Duoplex Steel  Цельная стальная конструкция без тепловых мостов  с прочными стыками   Все панели диффузионно непроницаемы благодаря двухстороннему стальному покрытию  Панели не содержат хлорфторуглерод  Толщина панелей  днище 125 мм  передняя стенка 50 мм   задние двери 96 мм  крыша 85 мм  боковые стенки 60 мм  Внутренние размеры надстройки  длина 13 310 мм  ширина 2 470 мм  высота 2 630 мм  Полная высота 4000 мм  Передняя стенка Из панели типа  сэндвич  с усилением и без выреза для холодильных агрегатов Carrier или Thermo King   испытана на прочность согласно шведским нормам   Вертикальные алюминиевые распорные профили для более лучшего поступления воздуха и оптимизации внутренней длины 100 мм  Откидная защитная пластина 4 мм    Крыша Из панели типа  сэндвич   со стальным покрытием  Пустотелая трубка для термодатчиков  пустотелая трубка для системы освещения  4 потолочных фонаря внутреннего освещения   установленные заподлицо  смещенные вбок  Включатель внутреннего освещения  срабатывающий от открывания двери  Боковые стенки Из панели типа  сэндвич   со стальным покрытием  покрашенные с внешней стороны  внутри специальное искусственное покрытие для перевозки скоропортящихся грузов   Алюминиевый поддон соединен по бокам и спереди с износоустойчивым угловым цоколем из алюминия  высотой 300 мм   Задняя стенка Прочная двухстворчатая дверь  каждая створка на 3 шарнирах из стали V2A  быстросменный уплотнитель с наружным уплотнением для защиты от пыли  Рама заднего проема из полированной стали V2A  с уплотнителем кромки проема по всей высоте  удобный внешний запорный механизм для обслуживания одной рукой  прочный фиксатор из троса для задних дверей   Четыре удобных запорных механизма для обслуживания одной рукой  внизу  2 позиционных габаритных фонаря на верхней части  Дополнительно Исполнение надстройки пригодно для таможенного опломбирования груза со свидетельством о пригодности для таможенного опломбирования груза   Воздуховод для более лучшего распределения воздуха  разъемный   Холодильный агрегат Термо Кинг SLX200 Руслан   работающий от дизельного привода   хладагент марки R 404 A  включая монтаж и запуск    Покраска Тип  окраска 13360 K серийная покраска  один цвет   стальные части отполированы  загрунтованы по технологии KTL и покрыты порошковой краской шасси и внешняя рама окрашены в цвет по выбору  оси и ступицы колес окрашены в черный цвет  колесные диски окрашены в серебристый цвет задний противоподкатный брус окрашен в белый цвет детали рамы и шасси окрашены в черный цвет или оцинкованы  надстройка окрашена в белый цвет RAL 9010 боковые противоподкатные защитные устройства окрашены в белый цвет Модификация  SD   Полуприцеп рефрижератор  количество осей  3 ,https://auto.ru/trailer/used/sale/krone/sd/16402800-80cfcc34/
Curtainsider,-11.0,True,2040023.0,KRONE,Вест Групп,25000.0,2300000.0,2018.0,Из Германии  Без пробега по РФ  Оси SAF  Подъемная ось  Резина оригинал с завода Бридж R168 15 5мм 16 00мм  Состояние нового  Алюминиевые доски  Запасное колесо   Возможен Лизинг,https://auto.ru/trailer/used/sale/krone/sd/16405080-c94822e7/
Refrigerator,12.0,True,4108154.0,KRONE,BS-Truck,,3650000.0,2017.0,В продаже полуприцеп марки KRONE SD РЕФРИЖЕРАТОРНЫЙ Год выпуска 2017 год Изготовитель ТС Германия Техническое состояние отличное Произведена проверка узлов и агрегатов  отклонений не выявлено  Характеристики  Тип РЕФРИЖЕРАТОР  Установка Thermo King  Наработка моточасов 5 090  Тормоза дисковые  Тип подвески короба  Оси SAF  Корзина под запаску на 2 колеса  Инстр  ящик  Противооткатный упор 2 шт   Разрешенная максимальная масса 39 000   Остаток протектора  Левая сторона  Передняя ось   Кама 80    Центральная ось   Кама 70    Задняя ось   Кама 80   Правая сторона  Передняя ось   Кама 60    Центральная ось   Кама 70   Задняя ось  Кама 80     Арт  30536 Стоимость указана с НДС  Возможна продажа в лизинг  в кредит и по программе Trade In  в обмен на Ваш коммерческий транспорт,https://auto.ru/trailer/used/sale/krone/sd/16410219-9be1d68b/
Refrigerator,11.0,True,4108154.0,KRONE,Юнион КРОНЕ Кимовск,,3670000.0,2017.0,Полуприцеп Krone SD рефрижератор 2017г  795934   Производство KRONE  Германия   Проведено полное ТО  3 оси марки KRONE  Подъемная ось  тормоза дисковые  АВS  рамный   Длина п п   13  62 м  ширина   2 49 м   высота   2 72 м   объем   92м2  Холодильный агрегат Carrier vector 1550  Металлические ворота на 2 х запорах  Собственный вес   8768 кг  Разрешенная максимальная масса   39000 кг  Нагрузка на ось   27000кг   БЕЗ ПРОБЕГА ПО РФ    100  РАСТАМОЖЕН     Состояние отличное  Техника готова к работе  Все документы в наличии Оформление за один час  Техника из Европы Все машины находятся в идеальном состоянии   Возможность приобретения в ЛИЗИНГ  с индивидуальным подходом к каждому клиенту на выгодных условиях   Мы являемся аккредитованной компанией в таких лизинговых  как Европлан  ВТБ Лизинг  Вэб лизинг  Элемент лизинг  Байкалинвестбанк  Стоун XXI век  ФМФ   лизинг    Уважаемые клиенты  обращаем Ваше внимание на то  что на сайте указаны цены за наличный расчет  Рыночные цены могут быть изменены в зависимости от экономической ситуации рынка  Всю информацию относительно комплектации  цены и наличия транспортных средств  Вы можете получить у наших менеджеров по телефону   Звонить с 9 00 до 22 00 по московскому времени  Своевременное техническое обслуживание  Посреднические услуги не предлагать  Готов к эксплуатации  Не требует дополнительных вложений,https://auto.ru/trailer/used/sale/krone/sd/16417943-35148c41/
Curtainsider,16.0,True,1917320.0,KRONE,АТРАКС,250000.0,1650000.0,2017.0,Крона   ШТОРНЫЙ ПОЛУПРИЦЕП С ВОРОТАМИ   2017 ГОД   ОБЪЕМ 92 КУБА   ТРЕХСТОРОННЯЯ ПОГРУЗКА   ТРИ ОСИ   ОСИ SAF   ТОРМОЗА ДИСКОВЫЕ   РАЗРЕШЕННАЯ МАКСИМАЛЬНАЯ МАССА 39 000 КГ   МАССА БЕЗ НАГРУЗКИ 6 590 КГ   ABS  EBS   ПНЕВМО  ПОДВЕСКА НА КОРОБАХ   ЗВОНОК БЕСПЛАТНЫЙ,https://auto.ru/trailer/used/sale/krone/sd/16437420-f0197f54/
Curtainsider,14.0,True,1913726.0,KRONE,Юнион КРОНЕ Кимовск,,1669000.0,2017.0,Полуприцеп Krone SD тентованный 2017г  763219  Состояние отличное  тормоза   дисковые  резина 70  ворота на 4х замках  Оси Krone  пневмо   рессорная  Собственный вес  6736  полезная нагрузка  39000 кг  Длина  1360мм  высота   2640мм  ширина   2460мм  Состояние новое  33 паллета  Проведено полное ТО  БЕЗ ПРОБЕГА ПО РФ    100  РАСТАМОЖЕН    Состояние отличное  Техника готова к работе  Все документы в наличии Оформление за один час  Техника из Европы Все машины находятся в идеальном состоянии  Возможность приобретения в ЛИЗИНГ  с индивидуальным подходом к каждому клиенту на выгодных условиях  Мы являемся аккредитованной компанией в таких лизинговых  как Европлан  ВТБ Лизинг  Вэб лизинг  Элемент лизинг  Байкалинвестбанк  Стоун XXI век  ФМФ   лизинг   Уважаемые клиенты  обращаем Ваше внимание на то  что на сайте указаны цены за наличный расчет  Рыночные цены могут быть изменены в зависимости от экономической ситуации рынка  Всю информацию относительно комплектации  цены и наличия транспортных средств  Вы можете получить у наших менеджеров по телефону  Звонить с 9 00 до 22 00 по московскому времени  Своевременное техническое обслуживание  Посреднические услуги не предлагать  Не требует дополнительных вложений  Возможна продажа в кредит  Готов к эксплуатации,https://auto.ru/trailer/used/sale/krone/sd/16440178-76fd1770/
Refrigerator,78.0,True,3753416.0,KRONE,,,2100000.0,2016.0,Полуприцеп без пробега по РФ  НЕ РАСТАМОЖЕН  Мультирежим есть  Допельштоков нет,https://auto.ru/trailer/used/sale/krone/sd/16462810-812ae454/
Curtainsider,13.0,True,1923131.0,KRONE,,160000.0,1700000.0,2017.0,,https://auto.ru/trailer/used/sale/krone/sdp_27/16127230-a899567b/
Curtainsider,-5.0,True,2017232.0,KRONE,Триера Трак,175000.0,2130000.0,2018.0,Продается полуприцеп Krone  Крона     Марка  Krone    Тип  Шторный    Год  2018    Оси  BPW    Тормоза  Дисковые  Осмотр полуприцепа можно произвести по адресу  Солнечногорский р н  д  Дубровки  ул  Аэропортовская  стр  6  Продажа возможна как физическим  так и юридическим лицам   Любая форма оплаты  нал безнал  Продажа с НДС   Готовы предоставить следующие услуги     Обмен   Trade in    ВЫКУПИМ ВАШУ ТЕХНИКУ В ЛЮБОМ СОСТОЯНИИ  Состоим в партнерстве с лизинговыми компаниями  ВТБ  Европлан  ВЭБ лизинг  УралБизнесЛизинг  Восток Лизинг  Элемент лизинг  РЕСО Лизинг  Альфа Лизинг и многими другими ,https://auto.ru/trailer/used/sale/krone/sdp_27/16361130-394ca9c6/
Curtainsider,16.0,True,1930110.0,KRONE,,98000.0,1650000.0,2017.0,Продаётся шторный полуприцеп Krone 2017 года выпуска  Без пробега по РФ  Объём   92м3  Оси SAF  Дисковые тормоза  Пневмо подвеска на коробках  Отверстия под коники имеются  Коники в комплекте  Резина   80 90  остатка  Корзина под запасное колесо  Инструментальный ящик  Состояние нового полуприцепа  Возможна продажа с НДС,https://auto.ru/trailer/used/sale/krone/sdp_27/16420908-e40c773d/
Curtainsider,0.0,True,1482446.0,MEUSBURGER,M7 TRUCK Санкт-Петербург,480000.0,1470000.0,2015.0,В продаже 16 метровый шторный полуприцеп Новтрак SP 360PR 2015 г   Прошел предпродажную подготовку   Резина в отличном состоянии   Выполнит любые транспортные задачи   Характеристики   Год выпуска  2015 Тормозная система  дисковые Разрешённая максимальная масса  38 000 Масса без нагрузки  кг   9 000 Количество осей  3 Количество запоров  4 Тип подвески  Интегральня Оси  BPW  Дополнительно  инструментальный ящик  ABS  сдвижная крыша  сдвижные шторки  Готов к эксплуатации   Торг возможен при осмотре   M7truck   это сертифицированные грузовики  седельные тягачи  спецтехника и прицепная техника с пробегом  которым Вы можете доверять   Любая форма оплаты  нал безнал   Возможна продажа в кредит  лизинг   Более 25 партнеров  Сбербанк  ВТБ  Европлан  Восток Лизинг  Сбербанк Лизинг  ВЭБ лизинг  Элемент лизинг и др ,https://auto.ru/trailer/used/sale/meusburger/tentovanniy_polupricep/16342838-23053a91/
Curtainsider,-3.0,True,1804850.0,SCHMITZ CARGOBULL,Вираж,200000.0,1880000.0,2016.0,92 м куб  Оси SCHMITZ дисковые тормоза  Армированный тент  отверстия под коники 3 ряда  усиленная оцинкованная рама и задний портал  подъемная крыша  4 запора на воротах  новая резина  Отличное состояние  Без пробега по РФ  Мы всегда рады Вам помочь и найти оптимальное решение для развития Вашего бизнеса  Все наши предложения смотрите в ПРАЙС ЛИСТЕ  кликнув в контактной информации на название ООО  quot ВИРАЖ quot   Возможен обмен на грузовую и легковую технику  Цена указана с НДС ,https://auto.ru/trailer/used/sale/schmitz_cargobull/s01/15950866-f2b5e215/
Curtainsider,-3.0,True,1804850.0,SCHMITZ CARGOBULL,АГТ-Трейдинг,235045.0,1880000.0,2016.0,Шторный полуприцеп без пробега по РФ  2016 года  объём кузова 92 м3  13 63 х 2 48 х 2 73 м   оси Schmitz  дисковые тормоза  полурессорная подвеска  Отверстия под коники   24 шт   в комплекте 7 коников  отличная резина  Код  201093,https://auto.ru/trailer/used/sale/schmitz_cargobull/s01/15962606-df1ba557/
