vehicleType,benefit,checked,valuation,make,supplier,mileage,supplierPrice,year,comment,url
Truck,14.0,False,4985438.0,IVECO,,109000.0,4350000.0,2018.0,Продается Грузовой тягач седельный IVECO STRALIS AT440S48T PRR  4х2 конец 2018 года выпуска в хорошем состоянии  Пробег 109 тыс км  Есть еще варианты тягачей 4х2 2018г с аналогичными пробегами и состоянием  Звонить и осмотр в рабочее время    Обмен  Лизинг не возможны  Предложение ограниченно по времени  Местонахождение  Ставропольский край  с  Надежда  МКР 1,https://auto.ru/artic/used/sale/iveco/stralis_tractor/16560590-6ed4a025/
Truck,17.0,False,3339612.0,KAMAZ,ООО УралСпецКран,30000.0,2850000.0,2017.0,Седельный тягач Камаз 43118 46 в отличном состоянии  пробег реальный 30 тыс  км Год выпуска 2017  колесная формула 6х6  спальное место ДВС Камаз 740662 Евро 4  КПП ZF 9S1310 TO Шины с подкачкой 425 85R21 Высота ССУ 1530 Нагрузка на седельно сцепное устройство 12 тонн Топливные баки  л 210 350 Тахограф Вложений не требует  цена с НДС  возможен лизинг,https://auto.ru/artic/used/sale/kamaz/43118_tyagach/16461650-66417015/
Truck,54.0,False,3855663.0,KAMAZ,,44000.0,2500000.0,2018.0,Автомобиль полностью исправен ТО производилось своевременно  С перегрузом не ездил   За машину не стыдно  Хорошая альтернатива новому авто  Возможна продажа с П П НЕФАЗ 93341 07 2011г  грузоподьемность 32 тн   Цена за сцепку 3100000  Возможна прожажа с НДС,https://auto.ru/artic/used/sale/kamaz/53504/16583924-e5d53b62/
Truck,30.0,False,1892905.0,KAMAZ,Global Truck Sales Санкт-Петербург,662800.0,1450000.0,2016.0,Седельный тягач Камаз 2016 года  Продажа за наличные  Тягач в отличном состоянии  ТО делалось регулярно  Тягач не имеет технических и юридических проблем  оригиналы документов на руках  Плюсы    своевременное техническое обслуживание    перед продажей проводилась полная диагностика   ходил без перегрузов   техника с полным НДС Техническое описание     Год изготовления  2016   Изготовитель  Россия   Объем двигателя  куб см  11 967    Разрешенная максимальная масса  кг  18 600     Масса без нагрузки  кг  7 900   Экологический класс  ЕВРО 5   Мощность двигателя  л с  401   Тип КПП  Механическая   Колесная формула  4х2   Тип подвески  Пневмо рессорная   Пробег  км  662 800 Дополнительная информация    Кондиционер   Магнитола   Инструментальный ящик   Солнцезащитный козырек   Автономный отопитель   Тахограф   Люк   Электростеклоподъёмники   ABS   Межколесная блокировка   1 спальное место   2 топливных бака  400 л   400 л   артикул 72134  Глобал Трак Сейлс   официальный дилер Mercedes Benz  KRONE  Sсhmitz Cargobull  Fliegl  Kassbohrer  Grunwald  Kogel  MAN  Wielton  Zaslaw  ТверьСтройМаш  Возможно приобретение техники в кредит лизинг   Мы являемся аккредитованной компанией в таких лизинговых  как Европлан  ВТБ Лизинг  Вэб лизинг  Элемент лизинг  Балтийский Лизинг,https://auto.ru/artic/used/sale/kamaz/5490/16284530-53f641ab/
Truck,13.0,False,2274507.0,KAMAZ,,360000.0,2000000.0,2017.0,Своевременное техническое обслуживание  Не требует дополнительных вложений  Торг возможен при осмотре,https://auto.ru/artic/used/sale/kamaz/5490/16296706-4591b5d1/
Truck,19.0,False,1892905.0,KAMAZ,Global Truck Sales Санкт-Петербург,685458.0,1590000.0,2016.0,Плюсы    Комплексная предпродажная подготовка   На руках диагностика  проведена перед продажей   хорошая компрессия  рабочее состояние   Хороший остаток резины   Цена указана с НДС  Техническое описание     Год изготовления  2016   Изготовитель  Россия   Объем двигателя  куб см  11 967   Разрешенная максимальная масса  кг  18 600    Масса без нагрузки  кг  7 900   Экологический класс  ЕВРО 5   Мощность двигателя  л с  401   Тип КПП  Механическая   Колесная формула  4х2   Тип подвески  спереди рессорная  сзади  полурессорная   Пробег  км  685 458 Дополнительная информация    Магнитола   Кондиционер   Инструментальный ящик   Спойлер   Солнцезащитный козырек   Автономный отопитель   Тахограф   Люк   Электростеклоподъёмники   ABS   Межколесная блокировка   1 спальное место   2 топливных бака Глобал Трак Сейлс   официальный дилер Mercedes Benz  KRONE  Sсhmitz Cargobull  Fliegl  Kassbohrer  Kogel  MAN  Wielton  Zaslaw  ТверьСтройМаш  Возможно приобретение техники в кредит лизинг   Мы являемся аккредитованной компанией в таких лизинговых  как Европлан  ВТБ Лизинг  Вэб лизинг  Элемент лизинг  Балтийский Лизинг,https://auto.ru/artic/used/sale/kamaz/5490/16333482-74c9a250/
Truck,12.0,False,1892905.0,KAMAZ,Global Truck Sales Москва Север,507000.0,1690000.0,2016.0,Седельный тягач Камаз 2016 года Один собственник  ПТС оригинал  эксплуатация с 02 2016  Тягач работал с тентовым полуприцепом  Не имеет технических и юридических проблем  Плюсы     Своевременное техническое обслуживание   Перед продажей проводилась полная диагностика   Магистральное использование   Без перегрузов Минусы  Незначительные косметические дефекты Рекомендации  сделать ТО Техническое описание     Год изготовления  2016   Изготовитель  Россия   Объем двигателя  куб см  11 967   Разрешенная максимальная масса  кг  18 600   Масса без нагрузки  кг  7 900   Экологический класс  ЕВРО 5   Мощность двигателя  л с  401   Тип КПП  Механическая   Колесная формула  4х2   Тип подвески  Пневмо рессорная   Пробег  км  507 000 Дополнительная информация    Кондиционер   Инструментальный ящик   Спойлер   Солнцезащитный козырек   Автономный отопитель   Тахограф   Люк   Электростеклоподъёмники   ABS   Межколесная блокировка   1 спальное место   2 топливных бака Глобал Трак Сейлс   официальный дилер Mercedes Benz  KRONE  Sсhmitz Cargobull  Fliegl  Kassbohrer  Kogel  MAN  Wielton  Zaslaw  ТверьСтройМаш  Возможно приобретение техники в кредит лизинг   Мы являемся аккредитованной компанией в таких лизинговых  как Европлан  ВТБ Лизинг  Вэб лизинг  Элемент лизинг  Балтийский Лизинг,https://auto.ru/artic/used/sale/kamaz/5490/16339302-dba218ac/
Truck,19.0,False,1611932.0,KAMAZ,,500000.0,1350000.0,2015.0,Продаю камаз 5490 низкая кабина  Комплектация под опасные грузы обслуживание у ОД резина перед 60  резина зад 80   отличное техническое состояние продажа в связи с обновлением парка,https://auto.ru/artic/used/sale/kamaz/5490/16502116-d93b06b4/
Truck,51.0,False,2043723.0,KAMAZ,,638000.0,1350000.0,2015.0,Продам  В хорошем состоянии,https://auto.ru/artic/used/sale/kamaz/5490/16506482-51c89687/
Truck,22.0,False,1975310.0,KAMAZ,Global Truck Sales Санкт-Петербург,707511.0,1610000.0,2015.0,Седельный тягач Камаз 5490 S5 2015 г в   Один собственник  эксплуатация с конца 2015 года   Регулярные ТО  с подтверждением сервисной истории   Хорошая комплектация  2 спальных места  2 топливных бака    Остаток резины по кругу более 40    Ходил исключительно под шторой  перевозил легкие грузы   Цена указана с НДС Техническое описание     Год изготовления  2015   Изготовитель  Россия   Объем двигателя  куб см  11 967   Разрешенная максимальная масса  кг  18 600   Масса без нагрузки  кг  7 900   Экологический класс  ЕВРО 5   Мощность двигателя  л с  401   Тип КПП  Механическая   Колесная формула  4х2   Тип подвески  Спереди рессорная  сзади  полурессорная   Пробег  км  707 511 Дополнительная информация    Магнитола   Кондиционер   Инструментальный ящик   Спойлер   Солнцезащитный козырек   Автономный отопитель   Тахограф   Люк   Электростеклоподъёмники   ABS   Межколесная блокировка   2 спальных места   2 топливных бака Глобал Трак Сейлс   официальный дилер Mercedes Benz  KRONE  Sсhmitz Cargobull  Fliegl  Kassbohrer  Kogel  MAN  Wielton  Zaslaw  ТверьСтройМаш  Возможно приобретение техники в кредит лизинг   Мы являемся аккредитованной компанией в таких лизинговых  как Европлан  ВТБ Лизинг  Вэб лизинг  Элемент лизинг  Балтийский Лизинг,https://auto.ru/artic/used/sale/kamaz/5490/16537080-4204959c/
Truck,36.0,False,1975310.0,KAMAZ,PRO АВТО,746229.0,1450000.0,2015.0,Тягач Камаз 5490 полностью готов в рейс  Состояние отличное  согласно оценке сайта ПРО АВТО  Установлена резина  1 ось   315 70 R22 5  Остаток протектора резины  1 ось   11 7 мм  2 ось   7 6 мм  КАК МЫ ПРОВЕРЯЕМ ТЕХНИКУ Мы продаем только проверенную технику и показываем ее реальное состояние  Наши специалисты проводят диагностику с помощью оборудования AutoCom  проводят полный осмотр каждой единицы и снимают процесс на видео  Показываем технику так  как если бы вы ее осматривали сами  Сертификат  где указаны все плюсы и минусы   а также видеообзор вы можете запросить у нашего менеджера  просто позвонив по телефону  КАК ПРИОБРЕСТИ Купить можно как за собственные средства  так и в Лизинг Кредит  Мы сотрудничаем с 26 лизинговыми компаниями и банками  Подберем для вас лучшие предложения на рынке,https://auto.ru/artic/used/sale/kamaz/5490/16554280-0dbea11f/
Truck,27.0,False,1975310.0,KAMAZ,Global Truck Sales Екатеринбург,596371.0,1550000.0,2015.0,Мы бережем Ваше время  поэтому готовы провести презентацию автомобиля дистанционно    снимем подробный видеообзор   выйдем в онлайн показ   проведем тест драйв  Подробности узнавайте по телефону __________ ЦЕНА С НДС Тягач с немецким двигателем Daimler OM 457LA мощностью 401 л с  Задний мост Daimler HL6  Автоматическая коробка ZF   На КАМАЗе установлено два топливных бака  400 400   датчик НАГРУЗКИ на ведущий мост  Высота ССУ   1 150 мм   Предпусковой подогреватель  Адверс  14ТС  Кондиционер  фен  подогрев сидений  электропривод люка  Тягач работал со шторным полуприцепом  Техника  продаваемая Глобал Трак Сейлс  проходит через полный комплекс предпродажной подготовки  Проводится диагностика ДВС  топливной системы  ходовой части  Производится чистка салона  а также устраняются посторонние запахи посредством обработки салона тягача технологией  Сухой туман  Техника готова к работе сразу после продажи  Техническое описание    Год изготовления  2015   Колёсная формула  4х2   Мощность двигателя  л с  401   Объем двигателя  куб см  11 967   Изготовитель  ПАО КАМАЗ   Разрешенная максимальная масса кг  18 600   Масса без нагрузки  кг  7 900   Грузоподъемность  кг  10 700   Экологический класс  ЕВРО 5   Тип КПП  Механическая    Пробег  км  596 371     Дополнительная информация     Инструментальный ящик   Спойлер   Противотуманные фары   Солнцезащитный козырек   Автономный отопитель   Кондиционер   Люк   Электростеклоподъёмники   ABS   Межколесная блокировка   Электрорегулировка зеркал   Количество спальных мест  2   Количество баков  2 Глобал Трак Сейлс   официальный дилер Mercedes Benz  KRONE  Schmitz Cargobull  MAN  Fliegl  Kassbohrer  Zaslaw  Kogel  ТОНАР  ТверьСтройМаш и многих других российских и европейских производителей грузовой техники Торговый партнер Global Truck Service  Мы являемся аккредитованной компанией во всех известных на рынке лизинговых компаниях и банках  ФМФ Лизинг  БайкалИнвест  Альфа Лизинг  Европлан  ВТБ Лизинг  Балтийский Лизинг  Сбербанк  Газпромбанк и др    Возможно приобретение техники в кредит лизинг,https://auto.ru/artic/used/sale/kamaz/5490/16570798-fe0b13de/
Truck,35.0,False,2152281.0,KAMAZ,Global Truck Sales Екатеринбург,425578.0,1590000.0,2015.0,Мы бережем Ваше время  поэтому готовы провести презентацию автомобиля дистанционно    снимем подробный видеообзор   выйдем в онлайн показ   проведем тест драйв  Подробности узнавайте по телефону __________ ЦЕНА С НДС Тягач с немецким двигателем Daimler OM 457LA мощностью 401 л с  Задний мост Daimler HL6  Автоматическая коробка ZF   На КАМАЗе установлено два топливных бака  400 400   датчик НАГРУЗКИ на ведущий мост  Высота ССУ   1 150 мм   Предпусковой подогреватель  Адверс  14ТС  Кондиционер  фен  подогрев сидений  электропривод люка  Тягач работал со шторным полуприцепом  Техника  продаваемая Глобал Трак Сейлс  проходит через полный комплекс предпродажной подготовки  Проводится диагностика ДВС  топливной системы  ходовой части  Производится чистка салона  а также устраняются посторонние запахи посредством обработки салона тягача технологией  Сухой туман  Техника готова к работе сразу после продажи  Техническое описание    Год изготовления  2015   Колёсная формула  4х2   Мощность двигателя  л с  401   Объем двигателя  куб см  11 967   Изготовитель  ПАО КАМАЗ   Разрешенная максимальная масса кг  18 600   Масса без нагрузки  кг  7 900   Грузоподъемность  кг  10 700   Экологический класс  ЕВРО 5   Тип КПП  Автоматическая    Пробег  км  425 578       Тип подвески  Пневмо рессорная Дополнительная информация     Два топливных бака   Инструментальный ящик   Спойлер   Противотуманные фары   Солнцезащитный козырек   Автономный отопитель   Кондиционер   Тахограф   Магнитола   Люк   ABS   Межколесная блокировка   Количество спальных мест  2   Количество баков  2 Глобал Трак Сейлс   официальный дилер Mercedes Benz  KRONE  Schmitz Cargobull  MAN  Fliegl  Kassbohrer  Zaslaw  Kogel  ТОНАР  ТверьСтройМаш и многих других российских и европейских производителей грузовой техники Торговый партнер Global Truck Service  Мы являемся аккредитованной компанией во всех известных на рынке лизинговых компаниях и банках  ФМФ Лизинг  БайкалИнвест  Альфа Лизинг  Европлан  ВТБ Лизинг  Балтийский Лизинг  Сбербанк  Газпромбанк и др    Возможно приобретение техники в кредит лизинг,https://auto.ru/artic/used/sale/kamaz/5490/16573398-86d13c53/
Truck,29.0,False,2189043.0,KAMAZ,,365000.0,1690000.0,2015.0,В связи со сменой парка   продам тягач Камаз 5490   Пробег 345 тыс  Отличное состояние   своевременное обслуживание в одном сервисе   все документы и история на руках   Чистый не прокуренный салон   Менялось все что требовал   Максимальная комплектация   люк   2 автономки и тд    коробка автомат   Из минусов   трещина на лобовом   Резина под замену   до зимы походит     Возможна продажа с ндс   За наличку сделаю скидку   Обмен на грузовую иномарку с моей доплатой   легковое Авто   лес   пиломатериал,https://auto.ru/artic/used/sale/kamaz/5490/16577106-d42f11e4/
Truck,17.0,False,2403138.0,KAMAZ,M7 TRUCK Казань,638727.0,2050000.0,2017.0,Продается седельный тягач Камаз 5490 2017 г  Хороший остаток резины  на механике  2 бака  Один собственник   Цена указана с НДС   Место осмотра  г  Казань Код  2486096 Характеристики  Пробег  тыс км   638 727 Год выпуска  2017 Марка  КАМАЗ Модель  5490 S5 Количество спальных мест  1 Колесная формула  4х2 Мощность двигателя  л с   401 КПП тип  Механика Готов к эксплуатации  Торг возможен при осмотре,https://auto.ru/artic/used/sale/kamaz/5490/16579338-934c5859/
Truck,21.0,False,2181700.0,KAMAZ,,556778.0,1800000.0,2015.0,В собственности на Юр  лице,https://auto.ru/artic/used/sale/kamaz/5490/16579594-d7ad2eaf/
Truck,36.0,False,2047128.0,KAMAZ,,414426.0,1500000.0,2015.0,Продаю КАМАЗ  Ездил один человек   Машина в идеальном состоянии  Электропривод подъема кабины  Чистый двигатель и МКПП без подтёков  Всё работает  Техобслуживание по регламенту  Чистый салон в максимальной комплектации  Абсолютно честная машина за реальные деньги  Любые проверки  в автосервисах  за Ваш счёт   Убедительная просьба  не звоните стоянки из Люберец  Капотни  прочих городов и весей нашей Родины  Я не поставлю его никуда  помогать не надо,https://auto.ru/artic/used/sale/kamaz/5490/16593748-6ac0ff2e/
Truck,10.0,False,1935262.0,KAMAZ,,451000.0,1750000.0,2015.0,КАМАЗ 5490 2015 год   Проверен у дилера  замечаний нет  Есть более дорогие варианты с меньшими пробегами  Возможен обмен с доплатой  на тягач Евро 5 6 не старше 2018 года с двумя спальниками,https://auto.ru/artic/used/sale/kamaz/5490/16597950-1f093426/
Truck,47.0,False,2043723.0,KAMAZ,,700000.0,1390000.0,2015.0,Отличное техническое состояние Полностью обслужен  вложений не требует Есть актуальная диагностика история всех заказ нарядов Пробег 700 т км Двигатель ОМ 457  объем 12л  Мощность 428 л с  Экологический класс Евро 5 Механическая КПП 2 топливных бака  Кондиционер Вебасто 2 спальных места Продажа от физ лица  без НДС  возможна безналичная оплата,https://auto.ru/artic/used/sale/kamaz/5490/16599784-dd64ef78/
Truck,43.0,False,1927548.0,KAMAZ,,613000.0,1340000.0,2016.0,Машина  в достойном техническом состоянии  гарантия реального пробега  Все полностью исправно  Мочевина отключена на программном уровне  Полностью готова к работе,https://auto.ru/artic/used/sale/kamaz/5490/16604160-b669a99b/
